no,title,artform1,artforms (new additions) ,artform,duration,plot,rationale,keywords,keyword1,keyword2,keyword3,links,category
16,"Raanti

Concept and choreography- @maijojojo
Performers - @ms.sayli @medha_chaudhari06 @hennrai @tanz_vi @maijojojo


",Contemporary Dance Movement,,Contemporary Dance,Not mentioned ,"This performance is contemporary dance movement installation that challenges societal norms and empowers women. By reclaiming the derogatory term ""Raanti which means barbarian,"" the performance celebrates the raw, untamed aspects of femininity often suppressed. Through powerful, embodied movement, it invites audiences to witness the transformative power of authentic self-expression and to reflect on societal pressures that often limit women's freedom to express their emotions fully.










","The installation's photo images truly captivated me with their movement, moment, and powerful message. Diverse female bodies, adorned in vibrantly unconventional clothing, took center stage in a unique performance. Their intimate interactions challenged societal norms and stereotypes about how bodies should behave in public spaces. The backdrop of painted storytelling added an intriguing layer to this thought-provoking display. ",,community,social commentary,storytelling,https://www.instagram.com/678.colab/p/DA5tO2BS6vo/?img_index=6,Body
17,Akshayambara (2015) | Sharanya Ramprakash & Dramanon,Play | Kannada,,Theatre,90 minutes,"Directed by Sharanya Ramprakash, this Kannada play by Dramanon Theatre discusses how female sexuality remains a subject that has yet to gain traction. An experimental work that premiered in 2015, it deals with the construct of gender performance - and shows how a male artist in streevesha plays Draupadi while in a tradition-defying move, a woman is cast as the Pradhana Purushavesha of Kaurava. What happens to the interpretation of gender when a man plays the streevesha and the purushavesha is played by a woman? Who is the real woman and who is the real man? The play uses the form of Yakshagana as well as ‘modern’ theatrical methods that interrogate the idea of representation of the female body, and consequently the notion of ownership. ","The play strikes a beautiful conversation around bodies, female sexuality and the inversion of gender roles in Yakshagana. It supports what is increasingly a bigger presence of women artists in the dance form. Moreover, Akshayambara’s set includes a Yakshagana stage as well as a green room, both of which are onstage. Both these aspects are big reasons for why this can be selected as a 'queer' performance. The play’s narrative moves between stage and greenroom - and between vesha (costume) and vastava (reality) - thus raising questions to the spectator and their role in the play. ","Bodies, Gender, Dance, Sexuality, Kannada, Yakshagana, Draupadi, Kaurava, Theatre.  ",interactive,regional,,https://vimeo.com/531388385 Director info: https://www.instagram.com/sharanya.ramprakash/?hl=en,Rewritings
18,A Thousand Years of Dreaming (2024) | Debashish Paul,Film/Sculpture/Art (Studio Exhibition) | English,,Mixed Media,7 minutes clip (available) - Full Film Length NA,"Debashish Paul's A Thousand Years of Dreaming uses performance art, sculpture, and film to explore queer identity in small-town India. His work reflects the struggles of queer men who conceal their desires due to societal pressures. The exhibition features performance stills, drawings, and sculptures based on the film Hazaro Saalon ka Sapna, where Paul merges personal narratives with ritualistic play, drawing inspiration from mythology, particularly queer depictions of gods like Shiva and Krishna. ","The form & content of this artwork makes another great queer performance - especially through the use of the three mediums. Despite working with big studios now, Paul's upbringing was certainly one of importance as he discusses navigating queerness in small-town India. The mixture of various forms coming together in the final exhibition - as well as in the film 'Beyond Body and Gender' mentioned here - makes it an abstract, surreal watch. ","Body, Transformation, Queerness, Performance Art, Desire, Religion. ",LGBTQIA+,regional,,"https://youtu.be/9sxcfPCzm_I  - 'Beyond Body and Gender', the film clip. Artist can be contacted at: https://www.instagram.com/debashish.paul.790/ (Their website: https://www.emamiart.com/artists/41-debashish-paul/overview/)  zip folder with all the artists complete works https://drive.google.com/file/d/1s-OWdBV8pzVa3lt3y7XBXm2Jm2SA_kW5/view?usp=drive_web ",Rewritings
19,Finding My Queer Body by Debashish Paul,Embodies Art Performance,,Mixed Media,NA - 15-20 minutes,"Finding My Queer Body by Debashish Paul is a solo performance that examines the journey of self-discovery and acceptance within a queer identity. Through expressive movement and narrative monologues, Paul explores themes of gender fluidity, body politics, and the societal pressures that shape queer existence. The performance is deeply personal, reflecting the search for authenticity and self-love in a world that often marginalizes and labels queer bodies, allowing audiences to witness the struggles and triumphs embedded in embracing one's true self.","Finding My Queer Body is a vital piece for the queer archive as it captures the embodied process of reclaiming and redefining one’s identity. Paul’s exploration of body politics and gender fluidity contributes to the archive’s mission of showcasing intersectional queer experiences, particularly through the lens of self-acceptance and personal liberation. It challenges normative definitions of the body, providing a raw and intimate portrayal that expands the archive's representation of queer journeys.","Queer, Body, Art, Debashish Paul",identity,collective memory,,https://drive.google.com/file/d/1s-OWdBV8pzVa3lt3y7XBXm2Jm2SA_kW5/view?usp=drive_web   ,Body
20,Queen Size (2016) | Mandeep Raikhy,Dance | English,,Contemporary Dance,45 minutes,"Choreographed by Mandeep Raikhy, it is an exploration - in response to article 377 - that took the form of a detailed study of the intimacy and lovemaking between two men. Played out on a charpoy, the duet examined the nuts and bolts – carnal, mechanical and emotional – of a close encounter between two male bodies. In deliberately making this encounter visible, Queen-size posed questions around spectatorship, privacy and dissent. ","Firstly, the performance runs in a continuous 45-minute loop, allowing the audience to enter and leave the space as they wish, from different angles. It is reported to have caused a 'shift' in many peoples' perspectives - after watching it. It is strongly non-durational and non-linear. There's a strong play with bodies, lights, props and music - navigating between dance/movement and performance art. ","Mandeep Raikhy, bodies, dance, article 377, homosexuality, performance art. ",storytelling,interactive,absurd,https://vimeo.com/207270036?share=copy Contact Mandeep at: mandeepraikhy@gmail.com,Body
21,A Male Ant Has Straight Antenna (2015) | Mandeep Raikhy,Dance | English,Experimental Dance ,Experimental Dance,53 minutes,"This is an ensemble dance performance publicly questioning various notions of masculinity - through the use of games, movement and touch. In an arena-like setting, bodies move around, playing with masculinity in different ways. It thus challenges myopic perspectives on the male body - and its orientations. Both male and female bodies move, contort and question this central quandary - in interesting, yet disturbing ways.  
","Following the Nirbhaya case of 2012, this piece of Raikhy emerged in response to ideas of gender hierarchy in the capital. Through this, Mandeep also seems to be exploring his own ideas of male bodies and masculinity; between hyper-expressive and effeminate ones. There's satire, abstraction and play - and Raikhy is able to use movement to describe what he can't with words. Bodies are explored, contorted, moved in different ways, singular and duet-based. What makes this unique and radical is this very subversion of body - through synchronic, abstract and radical movements - that makes the performance hard to define. 'A Male Ant' is queer in how it plays around with form and content quite effectively - and puts the audience at ease. ","Mandeep Raikhy, bodies, dance, masculinity, touch, relationships, homosexuality, abstraction.",resistance,identity,social commentary,https://vimeo.com/154162628?share=copy Contact Mandeep at mandeepraikhy@gmail.com,Body
22,Chrysalis (2023) | Artrysis,Drag | English,,Drag,NA. ,"Presented by Goa's Ryle Souto i.e. 'Artrysis', Chrysalis is a drag performance. Deeply evocative in nature, it is arguably about the author's queer journey, shown through wacking (dance) in a flower-styled costume - meant to signify 'growth' over time. It is about undoing the limitations and insecurities 'lined' within a body: and blooming in a new way, like a flower. ","Skanky and alternative in nature, it features avant-garde forms of makeup by the artist - and envisions body horror/fantasy in a new way; it is the latter element that possibly separates it from 'usual' drag. Like many drag shows that present queer or trans subjectivities in new ways, Artrysis's particular performance also does this in a playful yet disturbing way. Experimental and performance art in nature, it creates a beautiful blend of interesting form, props, makeup and dance. It is drag that horrors, astounds yet makes one think as an audience. Artrysis themselves see their drag and performance as reflexive: and adaptable to different venues. It is their politics as an indie artist which makes their selection worthwhile.","Drag, Artrysis, Horror, Experimental, Alternative art, Chrysalis, Camp, Performance art.",experimental,fusion,desire,Short reel clip: https://www.instagram.com/reel/Cnd1MyKj7Sk/?igshid=MzRlODBiNWFlZA%3D%3D Artrysis can be found at: soutoryle@gmail.com. Their website is https://sites.google.com/view/artrysis/performance-gallery?authuser=0,Rewritings
23,"Be-Loved (19th October, 2024) | Sapan Saran & Tamasha Theatre 
| KNMA Theatre Festival,
Sundar Nursery ","Theatre | Multilingual
",,Theatre,80-90 minutes,"This play, directed by Sapan Saran and performed by Tamasha Theatre, is an anthological exploration of queer love stories in an Indian context - using live music, fluid choreography and humour. With heartfelt coming-out stories and a search for ""happily ever after,"" it presents a vibrant patchwork of relationships. The performance skillfully balances song, dance, and emotion to depict the transformative power of love amidst societal pressures. It blends diverse Indian languages (Gujarati, Hindi, Urdu, Hindustani, English and Bengali) with non-linear storytelling to reflect the fluid, multifaceted experiences of queer love in India. ","Be-loved's active engagement with the audience creates an interactive space that invites reflection - and challenges societal norms surrounding romantic relationships. Fast-paced stories and the fusion of multiple languages help create a compelling, queer narrative. The performance is deeply introspective, encouraging the audience to reflect on their own roles in shaping gender perceptions. The play dynamically blends personal and political themes while experimenting with form and method, exploring queerness, the fluidity of love, and the notion of ""happily ever after"". Set in an open theatre, the play features bold, music-driven performances and public displays of sexuality through kiss scenes and intimate acts. The actors engage in highly physical interactions that challenge and break conventions between the body, space, and spectatorship.","Queer love, Anthology, Musical, Theatre, Joy, Poetry, Dance, Sexuality, Body, Space. ",fusion,LGBTQIA+,interactive,Be-loved. One can contact the theatre company at admin@tamasha.org.uk,Body
24,"Sadda Haq (2011) | Yaariyan | Queer Azadi March, Mumbai",\Dance Flashmob | Hindi,,Bollywood Dance,5-6 minutes,"The words Sadda Haq means 'my right'. Sadda Haq was Asia's first queer flash mob that took place in 2011. It was held as part of Queer Azadi March, Mumbai, organized by Yaariyan. More than 50+ queer individuals came out, and danced to Bollywood songs, as a celebration and claim for queer freedom and equality in India. ","Most Youtube searches of 'queer performance india' often lead to videos of queer flash mobs - many organized by the organization Yaariyan themselves. This led me to Sadda Haq, the first such mob to happen in Asia.  A flash dance mob on queer issues - but importantly reclaiming public issues, and disrupting public movement to communicate queer questions - stood out to me. Being the first ever such event to be organized by India, and the first one by Yaariyan, contributed in making this an important queer performance. Short, funny and 'masala' in nature, the sheer abruptness of the mob was queer to me. Mixing different genres of songs, while simultaneously chanting anthems and slogans of queer identity, the celebratory nature of the mob was beautiful.  ","Sadda Haq, Flash Mob, Queer, Bollywood, Dance, Azadi, Yaariyan, Section 377, Public. ",LGBTQIA+,community,,Sadda haQ - It's My Right! - Indian queer flash mob,Space
25,Alien Flowers (1996) | Sudarshan Chakraborty & Sapphire Creations,Ballet | English,,Contemporary Dance,40 minutes,"India's first queer ballet, choreographed by Sudarshan Chakraborty, Alien Flowers is a meditation on queer love. Staged first in Kolkata in 1996, it was centred around the story of a gay man navigating desire and prejudice. Narrated in English, it describes his journey from birth to death through the medium of poetry, dance and theatre. ","The play features a mix of dance, drama and poetry in conveying its message, and its trance-inducing English narration creates an alternate effect on its audience. The very introduction of an alien dance format like ballet is also interesting in subverting the spectator's gaze. In an intricate play of light and sound, both male and female forms of sexuality and desire are explored through individual and group performances. The form also intermixes both Western classical, and Indian classical forms of dance. Alien Flowers is a pathbreaking queer play that broke many traditions in the early 90s, and was one of the first Indian performances to sensitize people to queer issues. ","Alien Flowers, ballet, queer, Prejudice, Gay issues, theatre, poetry, English play, dance.",fusion,absurd,,ALIEN FLOWERS: Asia's First LGBT Dance Production 1996 | Sapphire Creations Dance Company - YouTube,Rewritings
26,Gentleman's Club AKA Tape (2022) | Amey Mehta,Theatre | English,,Theatre,80 minutes,"Set in the underground club scene of Mumbai, India's first drag king play, choreographed by Amey Mehta, explores drag in an Indian context. It follows lives of various drag 'kings' who perform in the city. Led by a main act called Rocky, who mimics Shammy Kapoor, this cabaret-like ensemble of female drag performers introduces stories - that intimately celebrate desire, satire and secrecy in the city. ","The play subverts masculine troupes through the performances of female 'drag' - in an imagined, inclusive city queer culture. The underground nature of the show adds a mystic element to a cocktail of music, dance and theatre. It is deeply experimental in nature - and uses Bollywood to add to what is essentially a glitzy setting of light, costume and stage design; there's a good use of dialogue that is both humorous and critical. Its queerness is also prominent in its adaptability: it is an act that can be adjusted to any venue. ","Gentleman's club, Drag king, Mumbai, Queer, Rocky, Bollywood. ",LGBTQIA+,fusion,,Gentleman's Club - Facebook,Body
27,Man-Woman (2023) | Gurleen Arora (Melancholia),Spoken Word Poetry | English,,Spoken Word,7-8 minutes,"Performed by Gurleen Arora aka Melancholia in Mumbai, for Kommune India, this spoken word poetry is a brief meditation on gender and identity - and explores the author's personal journey into her current transhood.  ","It is a performance that defies a strict form - playing around with poetry, songs and theatre. Through the harrowing 'man-woman' phrases that the speaker keeps repeating, it is a trance-like invitation to enter into the space of the performer. They employ a very lyrical way of talking about their trans-ness, meditating on identity and gender as they discuss their journey - even exploring their body through striptease to provoke the audience. Many 'spoken' word performances like these have come to dominate the queer performance space in India - and this fine performance has a certain ambiguity which qualifies it to be one. ","Spoken Word, Poetry, Kommune India, Gender, Trans, Theatre, Man Woman, Identity, Queer performance. ",identity,LGBTQIA+,Social Commentary,Man Woman | Gurleen Arora aka Melancholia | Spoken Word Poetry | Spoken Salon 1 - YouTube,Language
28,"Dil Dilli Dehleez (1 October, 2024) | Avatari Devi | Blackbox, Ashoka University",Spoken Word | Multlingual,,Nautanki,60 minutes (approx.),"Narrated by Avatari Devi (Swaja), this spoken-word Launda Naach form revolves around commentary about their queerness - and the city of Delhi and its various contradictions. It uses the various 'avatars' of Avatari devi to enchant the audience with an hour-long tale traversing various stories and disciplines.  ","This beautiful, intimate spoken play of words mixes various forms like striptease, song, Launda Naach, spoken word and poetry - to bring together Swaja's queer journey, and the journey of Delhi, in the same vein. Accompanied by electric guitar on the side, it is a deeply queer performance - reflective of thought behind CSGS's ADA series - and helps interact and question the audience quite a lot. They use multiple languages, employ a flirtatious tone, and intermix humor and politics well.","Avatari Devi, Swaja, Delhi, Spoken Word, Launda Naach, Dance, Poetry, Queer, CSGS, Ada. ",fusion,Humour,Regional,Dil Dilli Dehleez,Rewritings
29,Crossroads (2020) | Bettina Castano and Aditi Bhagawat,Dance | Multilingual,,Classical Dance,60-90 minutes,"Crossroads is a dynamic fusion of Flamenco and Kathak, created by Bettina Castano and Aditi Bhagawat, that explores the intersection of two rich, distinct dance traditions. The performance blends the fiery passion of Flamenco with the intricate rhythms and storytelling of Kathak, weaving together their unique movements, footwork, and expressions. Themes of cultural convergence, identity, and the shared human experience come alive - as the dancers traverse their personal and collective journeys. ","Accompanied by percussion, tabla and harmonium and sometimes jazz - this brilliant joint venture brings the intricacies of both dance forms alive. Given that flamenco, a gypsy tradition, itself emerged out of Kathak makes this venture more interesting - both have similar beat counts. The overall infusion of music, beats, movement and costume makes for an interesting queer performance that stretches the boundaries of space and time - allowing for an immersive experience. The blend of history and culture is beautiful.","Flamenco, Kathak, Crossroads, jazz, gypsy, culture, dance, aditi, bettina, rhythm, identity. ",fusion,Storytelling,Identity,Crossroads: An Indo - Spanish Dance Ensemble - YouTube,Rewritings
30,"Pehchan (2019) | Arvind Gaur & Asmita Theatre | Dyal Singh College, Delhi",Theatre | Hindi,,Theatre,20 minutes (approx.),"Pehchan is arguably India's first street play on queer matters. Directed by Arvind Gaur and performed by the progressive theatre group, Asmita Theatre, it explores the various taboos and forms of discrimation faced by the community - through various short 'takes' by different troupe members, it highlights various queer issues - like those of harrassment in the name of 'fun', police discrimination and forced marriages . The play has also been published in many theatre books.","The performance has extensively taken place across the university and protest spaces - acquiring a radical nature of its own, reflective of the theatre group's politics. Having the nature of a flashmob, the street play broke traditional boundaries of stage and spectatorship, allowing the audience to absorb the intense dialogues on offer. Compassing both individual and group performances, the form and argumentative content of Pehchan allows for an interesting queer experience in public. ","Pehchan, theatre, arvind gaur, asmita theatre, queer, taboo, jantar mantar, dyal singh college, public. ",resistance,Social Commentary,Interactive,(5) Asmita Theatre Group | Facebook,Language
31,Mukul & Pratik's dance duet (2020) | Choreography by Pratik Utekar | India's Best Dancer,Dance | Hindi,Dance as Political Discourse,Dance as Political Discourse,3-4 minutes (approx.),"Performed by two dancers in the 2020 edition of India's Best Dancer - this dance duet to the tunes of Tu Hi Re brought in contemporary dance to showcase the queer love between two boys - and how that is disrupted through one being forced into child marriage. It is a deeply emotional tale of longing, loss and emotion. The show is about dancers performing solo performances for the final 'big' prize of India's 'Best Dancer' - here, with Pratik being the choreographer-dancer, Muku was the contestant. ","While the theme actively deals with a queer angle, its infusion of contemporary dance with much different, exaggerated body movements makes for an interesting watch. The use of the cloth, the high acrobatics, and the musical and theatrical beginnings all make for an interesting queer performance. The moments when the dancers emotionally spill-over beyond the act - and the way they interact with the audience - remain key elements of the act. ","Mukul, pratik, india's best dancer, set india, queer, lgbtq, dance, tu hi re, child marriage.",desire,Social Commentary,Interactive,"Mukul और Pratik के "" तू ही रे"" Performance ने किया Judges को Emotional! | India's Best Dancer - YouTube",Body
32,"Wa*cking kya hai aap meri jaan lijiye (November 20, 2023) | Sangram Mukhopadhyay | Blackbox, Ashoka University",Wacking | English,Dance as Political Discourse,Dance as Political Discourse,60 minutes,"Performed by Sangram Mukhopadhyay, an emerging queer artist from Kolkata, this wacking performance explores the self, and its confusions with gender/identity. It explores the avenue of claiming open-ness in stretching the foundation of a form - and allies with queer refusal.","In essentially practicing wacking, a 1970s LA gay club style dance form, Sangram is mixing Indian classical mudras of arm and hand movement. There's a lot of play with light, space, shadow and movement, which offers flexibility to the performance. The auto-narrative style of dance and visuality infuses well with historical references to the dance form - while creating very commentary on dance as a form. ","Sangram, CSGS, Wacking, LA, Gay Club Dance, Dance, queer, gender, mudras, movement. ",fusion,Identity,LGBTQIA+,CS... - Centre for Studies in Gender and Sexuality - Ashoka University | Facebook,Body
33,Hijada,Marathi Play,,Theatre,Approx. 90 minutes,"Hijada is a Marathi play that centers around Kiran, a gender-nonbinary protagonist living in a Hijra household in Maharashtra. The play dives deep into the lives of Hijra community members, focusing on their daily struggles, solidarity, and resilience against societal marginalization. The plot unfolds in an unspecified locale, capturing the nuances of identity and belonging among the Hijra, who exist in the liminal space between accepted gender binaries.","The play captures the political and cultural misfitting of the Hijra community. In line with queer performance theory, the play disrupts heteronormative structures, presenting gender fluidity not as an object of ridicule, but as a site of rich, lived experience. By allowing the Hijra community to be humanized and de-exoticized on stage, the play counters the historical erasure of such identities in mainstream representations.","Performing arts, Hijra, gender nonbinary, family dynamics, marginalization, Maharashtra, queer identity, community representation",community,Resistance,LGBTQIA+,https://youtu.be/eaGm5YbnDS0?si=NXwfjCuVwZ2qmD1O    https://www.instagram.com/akankshabalrangabhoomi/?hl=en  https://www.facebook.com/aakanksharangabhoomi/?profile_tab_item_selected=mentions&_rdr  ,Space
